{
  "action_id": "FRONTIER-EVENT-DOCUMENT-DISTINCT-MECHANISM-006",
  "emitted_at": "2026-10-20T08:40:23Z",
  "event_id": "FRONTIER-EVENT-DOCUMENT-DISTINCT-MECHANISM-006-g2-777e6bb61990-1",
  "event_seq": 1,
  "event_type": "ACTION_STARTED",
  "generation": 2,
  "payload": {
    "lineage": "FRONTIER-EVENT-DOCUMENT-DISTINCT-MECHANISM-006",
    "queue_state": "WORKING"
  },
  "session_id": "FRONTIER-EVENT-DOCUMENT-DISTINCT-MECHANISM-006-g2-777e6bb61990",
  "worker_id": "oracle-research-v1.fundamental_events"
}
