{
  "action_id": "FRONTIER-FUNDAMENTAL-DISTINCT-THESIS-007",
  "emitted_at": "2026-10-20T10:50:14Z",
  "event_id": "FRONTIER-FUNDAMENTAL-DISTINCT-THESIS-007-g2-a2d5c6af399c-1",
  "event_seq": 1,
  "event_type": "ACTION_STARTED",
  "generation": 2,
  "payload": {
    "lineage": "FRONTIER-FUNDAMENTAL-DISTINCT-THESIS-007",
    "queue_state": "WORKING"
  },
  "session_id": "FRONTIER-FUNDAMENTAL-DISTINCT-THESIS-007-g2-a2d5c6af399c",
  "worker_id": "oracle-research-v1.fundamental_events"
}
