{"event_id":"market-discovery-flow-002-complete","session_id":"market-discovery-flow-002-g1","worker_id":"market-discovery-workflow","action_id":"FRONTIER-INSTITUTIONAL-FLOW-DISTINCT-MECHANISM-002","event_type":"ACTION_COMPLETED","event_seq":2,"generation":1,"emitted_at":"2026-10-18T09:12:00Z","payload":{"result":"FROZEN_HYPOTHESIS_NO_HANDOFF_AUTHORITY","hypothesis_id":"FLOW-UST-PRIMARY-DEALER-AUCTION-001","queue_state":"UNKNOWN","handoff_created":false,"authority_preserved":true}}