{
  "action_id": "FRONTIER-FUNDAMENTAL-DISTINCT-THESIS-006",
  "emitted_at": "2026-10-20T09:00:06Z",
  "event_id": "FRONTIER-FUNDAMENTAL-DISTINCT-THESIS-006-g1-8178be9b5650-1",
  "event_seq": 1,
  "event_type": "ACTION_STARTED",
  "generation": 1,
  "payload": {
    "lineage": "FRONTIER-FUNDAMENTAL-DISTINCT-THESIS-006",
    "queue_state": "WORKING"
  },
  "session_id": "FRONTIER-FUNDAMENTAL-DISTINCT-THESIS-006-g1-8178be9b5650",
  "worker_id": "oracle-research-v1.fundamental_events"
}
