{
  "action_id": "FRONTIER-EVENT-DOCUMENT-DISTINCT-MECHANISM-012",
  "emitted_at": "2026-10-20T19:10:08Z",
  "event_id": "FRONTIER-EVENT-DOCUMENT-DISTINCT-MECHANISM-012-g1-a2533c84482b-1",
  "event_seq": 1,
  "event_type": "ACTION_STARTED",
  "generation": 1,
  "payload": {
    "lineage": "FRONTIER-EVENT-DOCUMENT-DISTINCT-MECHANISM-012",
    "queue_state": "WORKING"
  },
  "session_id": "FRONTIER-EVENT-DOCUMENT-DISTINCT-MECHANISM-012-g1-a2533c84482b",
  "worker_id": "oracle-research.fundamental_events"
}
