{
  "action_id": "FRONTIER-INSTITUTIONAL-FLOW-DISTINCT-MECHANISM-009",
  "emitted_at": "2026-10-20T14:30:17Z",
  "event_id": "FRONTIER-INSTITUTIONAL-FLOW-DISTINCT-MECHANISM-009-g1-bcebf8885313-1",
  "event_seq": 1,
  "event_type": "ACTION_STARTED",
  "generation": 1,
  "payload": {
    "lineage": "FRONTIER-INSTITUTIONAL-FLOW-DISTINCT-MECHANISM-009",
    "queue_state": "WORKING"
  },
  "session_id": "FRONTIER-INSTITUTIONAL-FLOW-DISTINCT-MECHANISM-009-g1-bcebf8885313",
  "worker_id": "oracle-research-v2.market_discovery"
}
