{
  "action_id": "FRONTIER-FUNDAMENTAL-DISTINCT-THESIS-011",
  "emitted_at": "2026-10-20T17:40:25Z",
  "event_id": "FRONTIER-FUNDAMENTAL-DISTINCT-THESIS-011-g1-8af6c7c87551-2",
  "event_seq": 2,
  "event_type": "ACTION_COMPLETED",
  "generation": 1,
  "payload": {
    "active_count": 1,
    "claimed_count": 0,
    "queue_state": "QUEUED",
    "ready_count": 1,
    "result": "READY",
    "stage": "legacy_duplicate_check",
    "task_count": 66,
    "terminal_count": 65
  },
  "session_id": "FRONTIER-FUNDAMENTAL-DISTINCT-THESIS-011-g1-8af6c7c87551",
  "worker_id": "oracle-research.fundamental_events"
}
