{
  "action_id": "FRONTIER-QUANT-MECHANISM-DISTINCT-004",
  "emitted_at": "2026-10-20T05:50:14Z",
  "event_id": "dd4b6006bce28edf1fde24b53d00fd64559afd68f933538232f6ac29a6014140",
  "event_seq": 1,
  "event_type": "ACTION_COMPLETED",
  "generation": 1,
  "payload": {
    "next_lane": "market_discovery",
    "next_task_id": "FRONTIER-QUANT-MECHANISM-DISTINCT-004",
    "queue_state": "QUEUED",
    "ready_count": 1,
    "result": "DERIVED_ONE_READY_TASK"
  },
  "session_id": "dd4b6006bce28edf1fde24b53d00fd64559afd68f933538232f6ac29a6014140",
  "worker_id": "oracle-research-v1.integrator_portfolio"
}
