{
  "action_id": "FRONTIER-EVENT-DOCUMENT-DISTINCT-MECHANISM-010",
  "emitted_at": "2026-10-20T15:40:07Z",
  "event_id": "FRONTIER-EVENT-DOCUMENT-DISTINCT-MECHANISM-010-g2-b9201ce2a13c-1",
  "event_seq": 1,
  "event_type": "ACTION_STARTED",
  "generation": 2,
  "payload": {
    "lineage": "FRONTIER-EVENT-DOCUMENT-DISTINCT-MECHANISM-010",
    "queue_state": "WORKING"
  },
  "session_id": "FRONTIER-EVENT-DOCUMENT-DISTINCT-MECHANISM-010-g2-b9201ce2a13c",
  "worker_id": "oracle-research-v2.fundamental_events"
}
