{"event_id":"FRONTIER-EVENT-DOCUMENT-DISTINCT-MECHANISM-001-g1-001","session_id":"FRONTIER-EVENT-DOCUMENT-DISTINCT-MECHANISM-001-g1","worker_id":"fundamental_events_workflow","action_id":"frontier-event-document-research","event_type":"ACTION_STARTED","event_seq":1,"generation":1,"emitted_at":"2026-10-15T18:16:25Z","payload":{"task_id":"FRONTIER-EVENT-DOCUMENT-DISTINCT-MECHANISM-001","authority":"DOCUMENTARY_DISCOVERY_ONLY"}}