{
  "action_id": "FRONTIER-QUANT-MECHANISM-DISTINCT-005",
  "emitted_at": "2026-10-20T08:00:25Z",
  "event_id": "FRONTIER-QUANT-MECHANISM-DISTINCT-005-g1-8a58518b3dfb-2",
  "event_seq": 2,
  "event_type": "ACTION_COMPLETED",
  "generation": 1,
  "payload": {
    "active_count": 1,
    "claimed_count": 0,
    "queue_state": "QUEUED",
    "ready_count": 1,
    "result": "READY",
    "stage": "legacy_duplicate_check",
    "task_count": 43,
    "terminal_count": 42
  },
  "session_id": "FRONTIER-QUANT-MECHANISM-DISTINCT-005-g1-8a58518b3dfb",
  "worker_id": "oracle-research-v1.market_discovery"
}
