{
  "action_id": "FRONTIER-QUANT-MECHANISM-DISTINCT-008",
  "emitted_at": "2026-10-20T13:00:13Z",
  "event_id": "FRONTIER-QUANT-MECHANISM-DISTINCT-008-g1-f0781107653a-2",
  "event_seq": 2,
  "event_type": "ACTION_COMPLETED",
  "generation": 1,
  "payload": {
    "active_count": 1,
    "claimed_count": 0,
    "queue_state": "QUEUED",
    "ready_count": 1,
    "result": "READY",
    "stage": "legacy_duplicate_check",
    "task_count": 56,
    "terminal_count": 55
  },
  "session_id": "FRONTIER-QUANT-MECHANISM-DISTINCT-008-g1-f0781107653a",
  "worker_id": "oracle-research-v2.market_discovery"
}
