{
  "action_id": "FRONTIER-INSTITUTIONAL-FLOW-DISTINCT-MECHANISM-006",
  "emitted_at": "2026-10-20T09:30:24Z",
  "event_id": "FRONTIER-INSTITUTIONAL-FLOW-DISTINCT-MECHANISM-006-g1-e685ac32fd8e-1",
  "event_seq": 1,
  "event_type": "ACTION_STARTED",
  "generation": 1,
  "payload": {
    "lineage": "FRONTIER-INSTITUTIONAL-FLOW-DISTINCT-MECHANISM-006",
    "queue_state": "WORKING"
  },
  "session_id": "FRONTIER-INSTITUTIONAL-FLOW-DISTINCT-MECHANISM-006-g1-e685ac32fd8e",
  "worker_id": "oracle-research-v1.market_discovery"
}
