{
  "action_id": "FRONTIER-INSTITUTIONAL-FLOW-DISTINCT-MECHANISM-011",
  "emitted_at": "2026-10-20T18:20:09Z",
  "event_id": "FRONTIER-INSTITUTIONAL-FLOW-DISTINCT-MECHANISM-011-g2-60225f69df93-1",
  "event_seq": 1,
  "event_type": "ACTION_STARTED",
  "generation": 2,
  "payload": {
    "lineage": "FRONTIER-INSTITUTIONAL-FLOW-DISTINCT-MECHANISM-011",
    "queue_state": "WORKING"
  },
  "session_id": "FRONTIER-INSTITUTIONAL-FLOW-DISTINCT-MECHANISM-011-g2-60225f69df93",
  "worker_id": "oracle-research.market_discovery"
}
